{
  "id": "minigames",
  "name": "Minigames",
  "version": "0.1.1",
  "bundled": true,
  "private": false,
  "screen": "screen.html",
  "script": "screen.js",
  "settings": {
    "html": "settings.html",
    "server_files": [
      "minigames/"
    ]
  },
  "diagnostics": {
    "server_files": [
      "minigames/profile.json"
    ]
  },
  "routes": "routes.py"
}
